{
  "$schema":"https://json-schema.org/draft/2020-12/schema","$id":"https://hunteval.dev/schemas/v0.9/extension-manifest.schema.json","title":"HuntEval extension manifest v0.9","type":"object","additionalProperties":false,
  "required":["schema_version","id","kind","executable_sha256","supported_versions","requested_capabilities","network","tools","limits"],"properties":{"schema_version":{"const":"0.9"},"id":{"$ref":"common.schema.json#/$defs/identifier"},"kind":{"enum":["managed_tool","deployment_adapter"]},"executable_sha256":{"$ref":"common.schema.json#/$defs/sha256"},"supported_versions":{"type":"array","minItems":1,"maxItems":16,"uniqueItems":true,"items":{"type":"string","pattern":"^[0-9]+\\.[0-9]+$"}},"requested_capabilities":{"type":"array","maxItems":4,"uniqueItems":true,"items":{"$ref":"common.schema.json#/$defs/capability"}},"network":{"const":"denied"},"tools":{"type":"array","maxItems":64,"uniqueItems":true,"items":{"$ref":"common.schema.json#/$defs/identifier"}},"limits":{"$ref":"common.schema.json#/$defs/limits"}}
}
