{"schema_version":"0.9","id":"local-query-tool","kind":"managed_tool","executable_sha256":"eeeeeeeeeeeeeeeeeeeeeeeeeeeeeeeeeeeeeeeeeeeeeeeeeeeeeeeeeeeeeeee","supported_versions":["0.3"],"requested_capabilities":["local_read_only_data"],"network":"denied","tools":["query"],"limits":{"wall_time_ms":10000,"max_input_bytes":1048576,"max_output_bytes":1048576,"max_processes":1,"max_concurrency":1}}
